{
  "project_id": "cptu_bayesian_classification",
  "citekey": "robertson1990soilclassification",
  "candidate_score": 0.87,
  "rank": 1,
  "evidence": [
    "CPTu appears in project profile",
    "soil classification appears in title"
  ],
  "method": "lexical_v1",
  "created_at": "2026-05-06T00:00:00Z"
}
